{
  "version": 1,
  "title": "丛枝菌根作用与优势",
  "authorId": "n0009-generation-agent",
  "scenes": [
    {
      "id": "shot-01",
      "kind": "classification",
      "heading": "回顾：菌剂与菌根",
      "anchor": {
        "quote": "上一期我们介绍了",
        "occurrence": 1
      },
      "stages": [
        {
          "text": "真菌类菌剂的分类",
          "anchor": {
            "quote": "我们介绍了",
            "occurrence": 1
          }
        },
        {
          "text": "肥料类菌剂中的菌根",
          "anchor": {
            "quote": "和肥料类菌剂",
            "occurrence": 1
          }
        },
        {
          "text": "连接上期基本特性",
          "anchor": {
            "quote": "基本特性",
            "occurrence": 1
          }
        }
      ]
    },
    {
      "id": "shot-02",
      "kind": "process",
      "heading": "这期看机制与应用",
      "anchor": {
        "quote": "这一期我们着重讲一下",
        "occurrence": 1
      },
      "stages": [
        {
          "text": "从吸收机制开始",
          "anchor": {
            "quote": "着重讲一下",
            "occurrence": 1
          }
        },
        {
          "text": "看养分如何到达植物",
          "anchor": {
            "quote": "养分吸收机制",
            "occurrence": 1
          }
        },
        {
          "text": "再看实际应用优势",
          "anchor": {
            "quote": "是如何促进植物",
            "occurrence": 1
          }
        }
      ]
    },
    {
      "id": "shot-03",
      "kind": "comparison",
      "heading": "磷为何难被吸收",
      "anchor": {
        "quote": "一、强化磷元素的吸收",
        "occurrence": 1
      },
      "stages": [
        {
          "text": "磷素吸收是重点",
          "anchor": {
            "quote": "强化磷元素",
            "occurrence": 1
          }
        },
        {
          "text": "磷被土壤颗粒固定",
          "anchor": {
            "quote": "被土壤颗粒固定",
            "occurrence": 1
          }
        },
        {
          "text": "移动性差",
          "anchor": {
            "quote": "移动性差",
            "occurrence": 1
          }
        },
        {
          "text": "根系难以直接获取",
          "anchor": {
            "quote": "难以被植物吸收",
            "occurrence": 1
          }
        }
      ]
    },
    {
      "id": "shot-04",
      "kind": "process",
      "heading": "菌丝延伸，磷素转运",
      "anchor": {
        "quote": "丛枝菌根的根外菌丝可以延伸",
        "occurrence": 1
      },
      "stages": [
        {
          "text": "菌丝向根外延伸",
          "anchor": {
            "quote": "根外菌丝可以",
            "occurrence": 1
          }
        },
        {
          "text": "扩大探索范围",
          "anchor": {
            "quote": "更大范围",
            "occurrence": 1
          }
        },
        {
          "text": "难溶性磷转运过程",
          "anchor": {
            "quote": "难溶性磷",
            "occurrence": 1
          }
        },
        {
          "text": "提升植物磷素供应",
          "anchor": {
            "quote": "提升植物磷素",
            "occurrence": 1
          }
        }
      ]
    },
    {
      "id": "shot-05",
      "kind": "exchange",
      "heading": "氮素转运与微生物协同",
      "anchor": {
        "quote": "二、辅助氮元素的吸收",
        "occurrence": 1
      },
      "stages": [
        {
          "text": "菌丝转运无机氮",
          "anchor": {
            "quote": "丛枝菌根的菌丝可以转运",
            "occurrence": 1
          }
        },
        {
          "text": "与固氮微生物协同",
          "anchor": {
            "quote": "同时还能和土壤",
            "occurrence": 1
          }
        },
        {
          "text": "帮助植物获取氮素",
          "anchor": {
            "quote": "帮助植物更高效",
            "occurrence": 1
          }
        },
        {
          "text": "减少氮肥流失浪费",
          "anchor": {
            "quote": "减少氮肥的",
            "occurrence": 1
          }
        }
      ]
    },
    {
      "id": "shot-06",
      "kind": "classification",
      "heading": "不止大量元素",
      "anchor": {
        "quote": "三、帮助微量元素的吸收",
        "occurrence": 1
      },
      "stages": [
        {
          "text": "还关注微量元素",
          "anchor": {
            "quote": "除了大量元素",
            "occurrence": 1
          }
        },
        {
          "text": "锌、铜、铁等元素",
          "anchor": {
            "quote": "土壤中的锌",
            "occurrence": 1
          }
        },
        {
          "text": "减少缺素症状",
          "anchor": {
            "quote": "减少作物缺素",
            "occurrence": 1
          }
        },
        {
          "text": "关注贫瘠土壤条件",
          "anchor": {
            "quote": "在贫瘠土壤中",
            "occurrence": 1
          }
        }
      ]
    },
    {
      "id": "shot-07",
      "kind": "cross-section",
      "heading": "菌丝向根外拓展",
      "anchor": {
        "quote": "丛枝菌根促进养分吸收的原因",
        "occurrence": 1
      },
      "stages": [
        {
          "text": "拓展养分吸收面积",
          "anchor": {
            "quote": "主要是菌丝拓展",
            "occurrence": 1
          }
        },
        {
          "text": "根外菌丝继续延伸",
          "anchor": {
            "quote": "根外菌丝的总长度",
            "occurrence": 1
          }
        },
        {
          "text": "原稿倍数依据待核对",
          "anchor": {
            "quote": "数十倍甚至上百倍",
            "occurrence": 1
          }
        }
      ]
    },
    {
      "id": "shot-08",
      "kind": "process",
      "heading": "从根际走向周边土壤",
      "anchor": {
        "quote": "让植物根系的养分吸收范围",
        "occurrence": 1
      },
      "stages": [
        {
          "text": "从根际附近开始",
          "anchor": {
            "quote": "养分吸收范围",
            "occurrence": 1
          }
        },
        {
          "text": "延伸到周边土体",
          "anchor": {
            "quote": "周边更大体积",
            "occurrence": 1
          }
        },
        {
          "text": "提升养分获取能力",
          "anchor": {
            "quote": "大幅提升了养分",
            "occurrence": 1
          }
        }
      ]
    },
    {
      "id": "shot-09",
      "kind": "process",
      "heading": "养分形态转化",
      "anchor": {
        "quote": "同时，丛枝菌根共生过程中",
        "occurrence": 1
      },
      "stages": [
        {
          "text": "共生过程分泌有机酸",
          "anchor": {
            "quote": "分泌一些有机酸",
            "occurrence": 1
          }
        },
        {
          "text": "作用于固定矿质养分",
          "anchor": {
            "quote": "被固定的矿质养分",
            "occurrence": 1
          }
        },
        {
          "text": "转为可吸收利用形态",
          "anchor": {
            "quote": "可以吸收利用的形态",
            "occurrence": 1
          }
        },
        {
          "text": "提高养分利用率",
          "anchor": {
            "quote": "提升土壤养分",
            "occurrence": 1
          }
        }
      ]
    },
    {
      "id": "shot-10",
      "kind": "exchange",
      "heading": "根内丛枝：双向交换",
      "anchor": {
        "quote": "根内形成的丛枝结构",
        "occurrence": 1
      },
      "stages": [
        {
          "text": "丛枝扩大交换界面",
          "anchor": {
            "quote": "丛枝结构拥有",
            "occurrence": 1
          }
        },
        {
          "text": "植物向真菌供碳",
          "anchor": {
            "quote": "植物将光合作用",
            "occurrence": 1
          }
        },
        {
          "text": "传递碳水化合物",
          "anchor": {
            "quote": "碳水化合物传递",
            "occurrence": 1
          }
        },
        {
          "text": "真菌向植物供养分",
          "anchor": {
            "quote": "真菌将吸收的养分",
            "occurrence": 1
          }
        }
      ]
    },
    {
      "id": "shot-11",
      "kind": "comparison",
      "heading": "从交换机制到应用",
      "anchor": {
        "quote": "双向交换效率远高于",
        "occurrence": 1
      },
      "stages": [
        {
          "text": "原稿对比：吸附交换",
          "anchor": {
            "quote": "远高于普通吸附交换",
            "occurrence": 1
          }
        },
        {
          "text": "提升养分交换效率",
          "anchor": {
            "quote": "提升了养分交换",
            "occurrence": 1
          }
        },
        {
          "text": "进一步看实际应用",
          "anchor": {
            "quote": "实际的应用优势",
            "occurrence": 1
          }
        }
      ]
    },
    {
      "id": "shot-12",
      "kind": "process",
      "heading": "肥料利用与生产成本",
      "anchor": {
        "quote": "首先是刚才讲到的",
        "occurrence": 1
      },
      "stages": [
        {
          "text": "促进养分高效利用",
          "anchor": {
            "quote": "促进养分的高效利用",
            "occurrence": 1
          }
        },
        {
          "text": "提升磷肥利用率",
          "anchor": {
            "quote": "提升磷肥的利用率",
            "occurrence": 1
          }
        },
        {
          "text": "减少化肥施用量",
          "anchor": {
            "quote": "减少化肥的施用量",
            "occurrence": 1
          }
        },
        {
          "text": "降低生产成本",
          "anchor": {
            "quote": "降低农业生产成本",
            "occurrence": 1
          }
        }
      ]
    },
    {
      "id": "shot-13",
      "kind": "process",
      "heading": "减少流失，关注水体",
      "anchor": {
        "quote": "同时减少养分淋失",
        "occurrence": 1
      },
      "stages": [
        {
          "text": "减少养分淋失",
          "anchor": {
            "quote": "减少养分淋失",
            "occurrence": 1
          }
        },
        {
          "text": "关注水体富营养化",
          "anchor": {
            "quote": "水体富营养化",
            "occurrence": 1
          }
        },
        {
          "text": "兼顾生态效益",
          "anchor": {
            "quote": "生态效益突出",
            "occurrence": 1
          }
        },
        {
          "text": "转向土壤生态改善",
          "anchor": {
            "quote": "土壤生态的改善",
            "occurrence": 1
          }
        }
      ]
    },
    {
      "id": "shot-14",
      "kind": "classification",
      "heading": "土壤生态的多个层面",
      "anchor": {
        "quote": "能够促进土壤团聚体形成",
        "occurrence": 1
      },
      "stages": [
        {
          "text": "促进团聚体形成",
          "anchor": {
            "quote": "土壤团聚体形成",
            "occurrence": 1
          }
        },
        {
          "text": "提升土壤固碳能力",
          "anchor": {
            "quote": "提升土壤固碳能力",
            "occurrence": 1
          }
        },
        {
          "text": "优化微生物群落",